<?xml version="1.0" encoding="UTF-8"?>
<?xml-stylesheet type="text/xsl" href="hechoshistoricos.xsl"?>
<hechos_historicos xmlns:xsi="http://www.w3.org/2001/XMLSchema-instance" xsi:noNamespaceSchemaLocation="hechoshistoricos.xsd">
<hecho descripcion="IBM da a conocer el PC.">
    <fecha>
        <dia>12</dia>
        <mes>8</mes>
        <anio>1981</anio>
    </fecha>
</hecho>
<hecho descripcion="Se funda Google.">
    <fecha>
        <dia>4</dia>
        <mes>9</mes>
        <anio>1998</anio>
    </fecha>
</hecho>
<hecho descripcion="Se funda Facebook.">
    <fecha>
        <dia>4</dia>
        <mes>2</mes>
        <anio>2004</anio>
    </fecha>
</hecho>
</hechos_historicos>
